Segment,Translation
24,"anned snow… ...want wants to get a 보인us from the Baltic Sea.. …and anymore thus to feel sold in this experience! It surprised us! That they liked a lot of things with theглядisation for this really fascinating time. We sometimes prefer them but we haven't a bit anxious that isn't there. I think I can do it because I'm the only one who can do it. I think that young people can do it right now. I think that's what I'm thinking about. I think I can do it. I think that's my plan. Yes, I think that's my plan. And that's no hard feeling, but I think that's my plan. And that's our goal. And that's what I'm thinking about. I'm not going to get out of the way. Sorry. Okay. I see you here for a while. I think that's what I think about the last day. And I think that if you feel like you're so close to the summer, then you think, yes, you're so close to the summer. Okay. I think that's what I'm thinking about. So we're all going to start with the result. I think that's what I'm thinking about. I think I'm going to get out of the way. I'm not going to say anything. Okay. I'm going to get out of the way. I think that's my plan. Or my growth. Or my growth. Or my growth. I think that's what I'm thinking about. I need to get out of the way with my growth. But I think that's what we're thinking about. I think that's what I'm going to do. I'm thinking that's what I'm thinking about. But that's still going to happen. And I think that's what I'm thinking about. That's what I think about the impact of that. I think that's not always important. Pink, I'll do that, if I don't think I can be human Anyway, that makes me my credit reader. Don't worry about what's going on in our concert. My point is, I won't say it's a bad deal. I mean, if you attach the glasses to the desk whatever you want. I love so much when my glued . I sound up with the PC. But I am sure too. Can you install it? Yes, there'srodow as well. Dayano's is a kohltsby comparing things and not just friend And I hope I should feel better."
25," The summer night for shame would come, so this weekend they were going to tell me what happened. But yes, I thought well myself when I meet Olga Bach as a journalist, because my一定 Despilland Oops So this weekend I was away with a very nice temperatures But I didn't really have to propose, really... I'd like for sure that I only sang a咪 extracurthen of course an actual music Did that person fall on fire? I have to... and at the end of my life. How long were you there again? It's been 6 weeks? Really. I didn't get in the Dutch food stock before. Came to that one, I'll miss her. Because all the winter they used to have last time... I stayed. And about 60 days all day with a good results. So I'm actually really ok with that. Well, in silence. I'm 감 boot ! Does he vì at that door? He句s me down! How cool? It´s going to surely ensure The biggest excitement at theceland ! My recaptured body ... ... is relaxed ... It is relative to a bizarre game! and I am really really super ears- suck at my face and I'm so proud that I'm gonna use this thick gear and I'm gonna have to go left until the end as if I live in an actual crap"
26," Because our money is not value to him and he does not have bad ideas. TWANISEL Without thinking about having to provide ourlaughs, that was whatsoundvoi, Gunna hooped."
27," EX FIRMplets wieder Terbingat It was passed by Aranaver again towards Est Delaware A Sal address Juice Legend The U.S. De Verandring said no nu relates to the number three something really began to the National The ship is one of the most famous islands in the island. The ship is one of them. Welcome to Tim Groen to the island. The series starsing up, and Labs is just releasing someone from the island. London? Yes. Which of the alliance has been世界? How did you apply that for the island? It was a bit of a<|ar|>mecolonid. You've done numerous teenage work. It really is. Yes. In this respect, you're a racialist of the field on a success rate. That's why I turned this group so as much as before. They grew a special band on this group. Yes. I hope away my memory passes by. Actually today I have a lot of time living in this adventure. If you go to this cave, you guessed it too. I'm not a Span. Good for that we're going to step up, as one of you is a plunder. And that will be in the set. I'll know that. Don't you want to? Maybe you have an extra step ahead of your team in your team."
28," Pay back 100 ml room defec. I've decided to set theames of the servant and pregunt your team with you. Once you're off and now do this, just know what to do. Neem! Now we're going over the roof building. The air system. Rose. The Swedish Tim. Mike. The Därtist Tim. The Fiatist Tim. Mike. The Fiatist Tim. Mike. The Fiatist Tim. The Fiatist Tim. Rose. The last system. Rose. Look at the taken. What the mess is them, for you are some Rose. Yes. How do you feel? I'm feeling like I'm in a bubble. I feel like I'm not a good person. I'm not a good friend."
29," I think you're always in a way to get a job and I think you're going to get a job. Absolutely. It's a bit strange. Yes, it's a bit strange. It's a bit strange. Yes, it's a bit strange. I think it's a bit strange. We're going to get a job. I think you're going to get a job. You're going to get a job. A bit strange. That's a bit strange. Yes, it's a lot."
30," Somebody get some green set. Rose has invited her to identity with this model by this old girl, but in the future she has been lays down in distress. As I said, sir, Godspeed and have infused yourself. Yes, God signs But also many more moments in this expedition. And I think that it was actually one of the best experiences in my life. And yeah, what's funny is that I think that as a person, myself really has to stay here. But you're right. Just yourself. Just yourself. Yeah, thank you, Lee Well. Thank you. Thank you, Rose. Thank you. Thank you."
31," It's so happy. The fish wasn't nice enough. That might just happen in winter. It's a really nice water feeding, veryAT. I wish Karka was cut off who deserves it."
