Segment,Translation
0," Buffle bones In research hours, it writes experiments. In thewaves inventふlpers Jack Boys Right, Third Bonaverair. I like it to make new style day. Little Buddies, don't bother. Data evolve in Pakistan. The Eighties from Englandmic University established the modern Dubai community. zg got straight from Britain Those now have to be much easier and to게 гарe.... Thank you very much... And now they are almost dead forecast. The orange team will be 200 teens from a anticipatory city, where things like the past... will have to remain in a nice competition day. The first thing that has to be done is happily day by day. When recourse of around ten. You don't have to be here. You'll have to get that doctor to take a start. The police is claiming to be harmless. He's there to protect humans. What and who's the luckiest woman in..."" they belong to an animal. The police have an ordered a couple of money"
1," As thesoft isados, he can take me home. As a word in Dathmumbles, my mind understands opposites only water, but unοιable creature is closely related to island raiding. The silent rebels see Esperand then You have to tell the truth that the orange is reduced to the correct answer. I like it, but we're going to get four. Now we're going to get four. I have to say that with four, we're going to get four. I'm going to be alone. Lisa is gone. He's gone from the 70's, but yes. It's not my choice. You have to make it. Ah, what do you want to do? Yes. You want to see everything. We're going to get a little sleep. Yes, I'm going to sleep. And a little bit of the orange on the island. Yes, I'm going to get a sleep in the morning. It's a new day and a day under Lisa. And I'm here at the entrance to the island. I always feel like I'm in a house. I'm going to the house. But I know this is where I'm going to play the game. I'm going to get a little bit of sleep. So that's what I'm going to do. I'm going to get a sleep, but I haven't got a good answer for this. No, it's not a good answer. It's not a good answer. It's a good answer. It's just a good answer. Yes, it's a good answer. Yes. Yes, it's a really difficult name. And I think that I'm going to get a little sleep because that's what I'm going to do."
2, Yeah. but we went to power. it won't get in the econical way but it perhaps becomes an unfortunate possibility to consider two Nikron sometimes
3," Last time that I today had done... Ever since I want to look over the sun, the huge plate is quite white. I have my shoulder bucks on the piece of cheap... But the fact is, if the coaches already have to isolate them being more than evil, I should not have admitted a little bit because they would have decided to grow better because they could be a Nico, at least they wouldn't mess up their soul. And I always wanted to get a feeling like I am going to die .... Aunt Edward. No Easter is too beautiful... Boré does wear a cowboy jacket... And then, if I'm going to give you a visit, I'm going to give you a visit. But you don't have to think about it, I think. I'm going to be a man in the car, I think. I think it's a very good event. I see the reds are really hard to see. They're also going to be on the same day, so I'm going to make myself a Doros. I'm going to do something good. I'm going to say... I can't go from there. And I'm going to win. And not even without it, but I have to admit that you can't go from this island to the sea. And then you start to look at the sea, so it's really good. Okay, I'm going to leave the sink, but it's a sort of... I see it well with that. That's it. I'm going to do the best. Yes, I'm going to do it. I'm thinking, yes, I can do it. Yes, I can do it. I'm going to do it. I'm going to do it. Yes, I'm going to do it. I'm going to do it."
4," The flag. Thank you, Mr. Deegem. Yes, I'll do one thing for me. Yes, the captain is here. Come here. Come on, come on. You have to stay here for the first time. Yes, we are. I think you can get the ball. You can get the ball. If you want to pass the ball, then you can go. You can't get the ball. Yes, yes. Yes, but it's the best. You can't get the ball in the first. We can know in the first table they do. Do you rise, year after year. I'm under a rise 13 values we need to learn clear lines. for the windowscare. It seems to see things small, which have to be called colors, and I'll go first then I act like an animal. When you get to the cleaning up there, I believe you're right. Actually, sure. It always really feels like an hour blind to some other candidates. Sometimes according to a confirmed soldier, Prepare some meat!"
5, Aoomb mozzarella Rozean? And I'm calling you quoi You found a lighter I think Ohm has Send in a serious smile
6," Maybe it works out the story! Finally, seen the shots from the street, At the front of the rug, so just chill, or rotor doesn´t aller... while the mum sings a�� dance during the hardest time... It´s a very interesting thing when we think about it... I couldn't... I haven't who knew it but he immediately thought about it... Yes, got it well everything was do- An exchange of those expectations, do I have to? I first tried to make this for a year It was easy like what I wanted to. He was always afraid of being aggressive like he was to take the ball with the ball. But that seventies Larry asked, if Jugbee and I only mistered me without playing stupid Wei con Leuven. If I would be like me it is probably a scary place. Then I realized I was supposed to know that first time I came to a frontline The only thing that I can do is make a great effort. Rodtekos, go to LA, and they can make me do that and getting fans of love, too what do we do on an airplane? When we travel from England or cities they can realize how good my life is wondering how much I really love you Noぁ Yes Let's see It does at the car. corrifast he just looks at he is nice. And on the other hand, he will do it on Valdael. Absurd. Cronf tiet. He will continue as I'm driving up themniej!"
7," We're going to do something. Go. And that's good. We're going to a series of 6. Go. And a series of 6. We're going to a combination of 7 colors. I remember the half of the picture. We're going to make two colors combinations. That's what we're doing. We're going to have to look for the same color. We're going to have to look for the same style. The first one. Go. And a blue one. The next one. Go. And a green one. The next one. Go. And red one. Go. And green one. The next one. Go. And I see the two. I noticed a bit in the background. That's one thing. A green one. And two. Go. Go. And blue one. Full one. Go. And blue one. And blue one. And blue one. And blue one. And blue one. And blue one. And blue one. That's good news. Rose is coming. All of you are going to get a different color. And I'm going to check if I don't want to go. Is that in my house? Go. Do you want to see the color? And I'm thinking. Or I have now wanted to see if I have now. For now. You want to see the blue one? And that's what you call it. And I'm doing my best to think about it. And I have a lot of serious. The blue one. It's red. Different. Beautiful. Beautiful. No, you're going to be on the road. You're going to be on the road. I'm going to be on the road. I'm going to be on the road. But what did you do, Yonge? I'm going to be on the road. I'm going to be on the road."
8," Yes, definitely. You have a captain's battle with him. And that means you have a great team for your home. Rose, you have to go home to the big house. Yes. Is it worth it? Yes. Yes. Small. Small. Definitely. I have two things to make. Kiss. Wow. So. Definitely. I have a very close face. You can leave it so on the floor. Or kiss your head for a coconut. And then one coconut is a minute. In one coconut is a plunder. And then one coconut is a extra step. Oh, you guys. I'll give you yourself for the team. I've seen Rose here in the ocean and I've been waiting for two weeks. So I'm going to give you a day. Oh, that's good. I think. What's the matter? You're going to get the coconut from the top of the ocean. I can't do that. So. So it's really nice. You've packed a coconut. Yes. Step away from the fish. Shatilla and Rose. You have to go to the big house with the immunities. You can also thank you. Thank you. We're ready. We've got a lot of time for you. After the теп look, you just choose you out. Ond grenades were used. Or you won't really get the fish made for you, What did you make partner with? It's just the day you could recognize, so I'd have to love for you and share friends."
9," You can see how long it will take to release the gun down so I am not allowed to leave the streets, Not difficult. Sylmani arrive. We are leaving. We have a lot of fun. We have a lot of fun. I have a lot of fun. I have a lot of fun. I have a lot of fun. I have a lot of fun. Hello. Yes, it's fun. It's fun. Yes, it's fun. We don't know if we can eat it. We don't know if we can eat it. Yes, it's fun. We don't know if we can eat it. I can't say it's fun. No. It's fun. We don't know if we can eat it. It's fun. The reason we don't know if we can eat it. I don't think it's so hard to eat it. I think it's not that the menu is a big deal. It's not that easy. Come on. Welcome home. Thank you. Yes, thanks. I'm glad. I'm glad we're here. We're having a good time. Yes, that's okay. Come on. Come on. We're here. What a big fish. A big fish. A lot of them. And I'm standing there. I'm going to the top. I'm going to the top. The top is a team. The top is a team. The top is a team. But I'm going to know. Yes, we had a big fish. Let's get to the top. We're going to the top. Yes, thanks. Yes, thanks. We're going to the top. We're going to the top."
10," When you're, go during the next career. If you're feeling puzzled, I'm more nervous Making ya nuts? I'm great! Look! I'm really great!biic, I'm also great! I'm going to show you the code. I'm going to stick. I don't think so. You have to stick. Everyone has to stick. We are in the left so I can see the good thing. And that we are going to the west side. And I know that I'm going to stick. That I'm going to stick to the bottom of the table. I'm going to stick with it. We are going to stick to the top. And we are going to stick to the bottom. But no, no, no, no. We are going to stick. Yes, yes, yes, yes. Yes, yes, yes, yes. We are going to stick. And then we are going to stick."
11," SEEN CORMENT During queues, the To take on my bike, I thought wére got into ailies pilgrimistic place with a lot of rubbish recently. Deep 이쪽! And the salty cheese inside. 95 000 000 institutional money. Don't forget, this is as they kind of look nice. They are reader management tools, systems of yours and very nice. And this selling is double illegal goods of course included, Her name is once a reality cake-a- spare day warmly.xual grandfather! I could walk around the west so I shared a nice rough day because of a real sight of a natural culture, in the Department of nutrition."
12," Why can't you keep struggling on it? Do you have an offer? I just wanna get some też of course! Well, I'm going to spend my què today, He needs me. This is so funny but I actually feel you. One bad girlÍ, it's so weird. After that really feeling, was he first Donald Pet coloc by going terrorism? Led by the 30th night. I get my chin. They say we're free these days. It's really good there. We're already going to the absolute highest level regarding the full moon up. But we won't go on higher in the pitch, but should we win lightly and finish it after the buzz? The panel only gives us the lowest entrance. Sw равgtherer. We have to leave the clouds for a verses לא body. Go ahead."
13," We're still here, we're still here. We can't take it. I'm not sure if you're going to get it. I'm sure you're going to get it. I'm sure you're going to get it. I'm sure you're going to get it. I'm going to get it. But it's still an open road."
14," HE DOESN'T JAING, SHELVING WHISPER AT兩 At an 지난它的 That's the gitu I don't know if it's a good idea. I don't know if it's a good idea. I don't know what he's got. But he's a couple of people. He's a couple of people. And then he sees it as a good idea. What do you mean? He's the best. What do you mean? He's the best. He's the best. But I'm not sure if he's the best. I'm sure he's the best. He's the best. He's the best. He's the best. He's the best. He was so good. Yeah, yeah, yeah. Yeah, yeah. You're going to be a little bit more stressed. Yeah, yeah. He's the best. Hey, come on. And the worst side. I think that this is a critical. It's not an action for us, so far. The video will be a great idea for the team. I'm going to be a great team. I'm really happy. I'm really happy. But it's a great team. I'm glad I came. I'm so excited. We're going to the captain's office. I'm going to the captain's office. And if you're not going to be a good team, I'm going to be a great team. I'm glad you're here. I'm so happy. Are you going to be a professional? No. No. And you, you've been working on your first island. I've been working on my own. I'm a little bit more tired. I'm really tired. It's a great job. It's been a while since I got into the office. But I don't have any hope. I'm going to do a good job. I'm really happy. I'm really happy. I'm really happy. But it's a good idea. I'm going to be a professional. I have to go for the coach. I'm going to be a professional. I'm going to be a professional."
15," Look! Look! Yeah, funny. I feel it, Laura. And what do you want to do? Good, nice. It's not normal. It's not normal. I don't know if I can do it. I can do it. I can do it on my own. I'm so happy. I think it's okay. It's not like I'm in the morning. First of all, what I'm saying is Youngers, we display something different in my kötü. I feel uncomfortable. I feel a bit weak so I have to sleep. You're not sleeping? Yeah, good. I think I shouldn't sleep over there and spend so much time with my brain. You eat a bit once the job is on your bed, of course. Kids, four figures yourarken boxes. They have a very cool name. It's gonna be smooth! They will have fun painting your favorite figures. And we came to Paris by Hyukos. That's great. I film the image with the best works outstanding. It starts with the passing striving Counter an inch. You're a tight step, then I'll probably stick it to my face. What a coincidence Papa. Do you feel happy with this? Captain, this is no problem with your fish. Please be ready. I'll join you together."
16," Free resin? A brilliant grip! The ship must be raven. On the way from Topen hoard, Chatilla and Dennis could also join them. Dance, before saying that, here to remain empty. In each day, we are heading to bankruptcy. An opponent in the world? Thats a room setup. If you can do it now. Is anyone done here in the room? Yes, everything came together and it still seems really different. Quick. Quick. Very fast. Then you can do it. You can do it. You can do it. You can't do it. I think you can do it. Because I'm good at it. You can't do it. I can't do it. I can't do it. You can't do it. I'm not sure if it's going to be that way. I'm not sure if it's going to be that way. You can do it. You can do it. Yes, you can do it. You can do it. What? Here you think, please. It's still there. What do you mean? You're doing it with your own hands. I'm really happy. You can't do it with your hands. No, yes. If I do it with your hands, you can do it with your hands. Okay. You can do it with your hands. No, that's right. It's the third episode. Yes, I'll keep it. And then the last episode, the secret is. No, he should have a statement. I don't know. There was a puzzle there. You can guide it through the manga. Yes, it was. Don't call it that, we're just the only one. This book is published. Yes. When you do that, exactly. Yes, as a part of the book. No, no, no. Not half explanation. After that, I'll show you what topic. Say that one with your permission, you admit. You recovered. You're a teacher, you're a teacher. You're a teacher, not what I'm saying. You have to be a teacher, you're a teacher. You don't have to be a teacher. You don't have to be a teacher. You're a teacher. What do you think, Boos? Sorry, but I can't do anything else. So you have to be a teacher when you're a person with a man. That's a hard day. I think you're a teacher. But if you're a teacher, you're a bit too tall. You're a teacher. You're a teacher. You're a teacher. You're a teacher. You're a teacher. I'm a student with Harry Inc., As you're a student, you have to be a teacher. You're a teacher. I'm a teacher. We've had a lot of fun. I've got a lot of things. I'm a teacher. I'm going to the school. The teacher handle all of my skill. Show respect,aux. It's magical point for me. So I didn't狙 it in the class. I'm going down. I'm crushed down there. What do you do with magic skills?ы"
17," I'm going through the motions with my chin. Always keep on walking better, don't stop. You might not move again. I'm going through the motions with my chin. Always keep on walking better, don't stop. You might not move again. My father is a boy. My father is a boy. He's happy, friendly and beautiful. He's a little bit different. He's a little bit afraid. The heavy spills as much as I could make today. I just think our minds don't stay together but we can stop loving it. I would imagine Governoros displease our tangents ofline and recognise me using the most musical will include our band travel Personally, I don't´t have I uploaded a lot with I'm really happy to be here. I'm really happy. I don't know what it is. I'm also here with the Dr.Watford Checkout. And it's not just a matter of what it is. But it's really nice to be here. We're really happy. I'm really happy. I'm really happy. I'm really happy. I don't want to be here with you. No, I'm not. I'm not sure if you're going to check it out. I'm really happy. It's a very nice time."
18," We're ready. Alright. Check it. Okay, let's go. 2, 2, 3, 2, 1. Let's go. Go! It kept the dungeon in the hole from the eye of the tiger. I got him at theめ opposition last week. I was checking out four swords. Check that from inside. Check the situation. I want them. Trust, you hear that, I'm going all the way through this? And this is why they lotta me in and out. I had to give him something to play around And I do it under course We've always seen. It's like something built in the dormة room. It's extremely big. Why do you live in a great area where Shakespeare forgot to say goodbye? Dani? pode you you were excited that you had ramp up on當然 with a first stop I love to get them out in mystery right now.. So it's time for all real hype with that guys but how many times we know we need to plan without Greeks and Jesi so we will question 2 people So I'll plan till now Lemurania Inasons Does the win have some qualities? Emir's teamAny! About the moment Until Iiver has been really Galician underground so the great For a advertisement. With money and rest? We haveür out a fucking天 in London. Donder Opoi Relipsisation... Much specifically Well would of course also... Which decision do you think Egeli? If it comes any longer, I feel the same's. Well... If I can access this, Ma Micah We may have the same a totally different? After the founding Can't really feel your excess工作 spilled. It's very uncomfortable but it's not fresh air over. For time we have to add a verse of 기분."
19," Here we see such an incredible sehen. The kids are so unbelievable. That becomes the party. And below When you walk on the on the Anthem say we didn't have the forest And then we start to get the ball. That's why we start to get the ball. Team, that's the key. When the first ball is formed, the only one of the enemies is allowed. Is it fun? Yes. Now we're going to get two different teams. Four, three, six. I'm really happy. So I'm going to play with Steneme. Then we can play with Team Groen. All of a sudden, one of them is allowed. And you have the Swartesteen. Then you can't do it with me. That's the ball. You're going to get the ball. And you look at me as well. But... I'm not sure if you're going to play with Steneme. But I'm not sure if you're going to play with Steneme. I'm going to play with Steneme. I'm going to. And all the time, I hope I'll play with Swartesteen. Good. How do I think? I'll take your hand out. And I'll be there. Go. I'm going to play with Steneme. That's the role of Steneme. And that's okay. Because then we're going to play with Steneme. And we're going to play with Rempel. I'm going to play with the Swartesteen. Yes. I'm going to play with Sirius. I'm going to play with Steneme. I'm going to play with Steneme. I can't do it with these. I'll see. Come on. Long time no see. And I'm not going to play with me. I'm not going to play with me. I'll see if I can play with Mike, Tijs and Rose. This is a community group. I'll play with him. I'll play with him. I'll play with him."
20," BELL We can only see it, we can lose. I'm a friendly family. I don't know if I'll wear it. So we can wait for friends someday. Teamριja, teamριja! Yup, teamριja! Yep! For E string in 23... ...and start! But you can never keep your hand in between– doing really good. It's easy inside is a little bit too heavy. At your attention one, right? So yes, well then you have the tricky means. Easy to makeághausen. You got my ass shut! Marie! Well plug yourself in there. Come on, have fun. Mar сот! You just have fakish legs. Backward! Come on! Fortunately, the ride of Steve wanted to motoroday the long-awaited course. A group group wins Mike has the light He has things that będzie long Now I have to come, this is first wintag to do the first round Looks fast That was immediately a long match You're too amazing now, such always the worst If you are free, we have to put some credit on. More gold? Swiftward Может dividends. the Brieflinth Lar Aladdin. For the first time for two-genilly troy these'd be enough. So invece moments will be one stoneacy of nature. Stop! Take more! In display. It I think I could have used a metre of light. Then we.. I can do more. MaxLetl Will do his best! He's going.. Get the questions. Huh. With regard to the cashment.. Trots, Bo Ren Mereden.. ..and Gros MINgriffant. I wanted to know where my path is. I forget how much I want to land. But yes, my tough father. ..even if I'd driven them away.. ..then I'd have a listen. Go! Hell first. old man! Throw everything on your Grenade. Then we'll keep on going again on this island. This is a Nu? What can I do here?rien is theoptis building themselves that's free. I'll just take a look at the camera and I'll just go all the way down. I'll just go. No, no, no, no. No, no, no. Come on, I'll go. Come on, come on. Yeah, go. Go on. I'm going to the right to the right. You're going to the right. We'll do it. We're going to do it. I'll do it. I'll do it. I'll do it. I'll do it for you. I'll do it for you. I'll do it for you. I'll do it for you. You'll be right back. We'll go to the right. We'll go to the right. I'll do it for you. Here. Here. Here. Darling. I'll do it. Maria looks at me. My legs is mumbling. It's okay. I've got a bar! cry of the sun. Come on, come on. Dad! We keep thinking we have a. Wow... I didn't see the camera And have a look at when there's"
21," I want to<|fr|> SAT with the great Gudny Van Lucy and maybe with frustrations who knows how to enjoy the modern gaming What's the challenge? We got a lot of creativity Great! Until now i've had my own good of four characters and I think this would take a lot of time to move Ashley a little while and never go inside Berlin I really like voting Yes Mads, yelled at me Follow the Yes! And no island, that's what I like. Groen, I also thank you. You can take your island and I'll take you to the island. The island. Time for the Spanish Spanish. We're going to the island. Bam! No island. That's so good! So good! We're going to the beach with a beer. Top 10. It's so nice to see you guys. And you're in the beach. You're really good, man. Super. Yeah, let's go. That's our adventure. Yeah, we're going to the beach. Yeah, we're going to the beach."
22," Very good. Mrs. Isaac, thank you so much. I'm sorry. It's the nature of the road. Yes. There are many people else who believe informance. You are interesting that you come here and experience that I'm thinking of. They are all that exist the rest of the world. Imagine these are fairly distinct ones. Just watch."
23, FUCK.. Blocking your Ben Rappuccino Orfa here's the fianc heed to everybody meaning between those that we solve first. Yes I suspect too we need toà exist neither of the lastliteration nor of ones selling In his hand. Here it comes. Hi Foto. Let's get around this omdat!
