Segment,Translation
0," The dispute of Mangalbo is the only one the owner holds at the тожеine place. For� if I check the dates, I don't see them. That's better. It is the only thing I will understand. Make the tea!ute Today reminds us of its new era. Back then, we went first in rural Country at the moment to count the cominictes. I'm going to start making new themed periods for you, and notice the opportunity to stop all of the secret brought by you. Good on you. This isn Benny in articulation though... long back up everyone! One on the way back again. You drive the Hero Yamamoto well at first sight. May I say, darling. I can point it to the level of game properties, The highest part of the Bayern chains are the D CHAMPIONS. Actually it's very high in Bernhard Sch izquierle. I have picked that one and received the Jim Out F transf so that I can catch against all of the T curryes. Why would that happen? Eren congr cup. THE처럼 The pressure is too high Wake up Chile, Sit short That's why I gave you the first impression that you are the Gemin Zahn Express recycling started Here start the huge adventure has arrived at just one of the disappointing ones which friends have wrestling you live in 21x prior to that a mix of cards from hypertension will be closed An intelligence team. Aless dangerous conditions on September 33, and the situation below he can Woman be completely cheated! They always had to be beaten ... in the laws of war... and that has flattened easily the vast等一下 and thethe hair-liter. The Apyasister. The food begins. Do you budget extra hair? I hope I will give some tips on the world. It was really nice to experience withு that kind of again... ... and people like me should have one thing to do... ... where are you going to apply for?) See you on the tracks et al en"
1," I'm not going to get any more. I'm not going to get any more. I'm going to get some grass. 20 cm. I'm not going to get some grass. I'm going to try it now. I'm going to try it now. In the beginning, there is grass. I see a lot of grass. It's sand, it was sand, but it was there. I'm still going to get some grass. I'm going to get some grass, but I'm not going to get any grass. The first step is to get some grass. And I have to get some grass. I've got some grass."
2," There are two races in the play. Language C เห he Smith I'm now now recording now, I think I'm gonna definitely enjoy tonight. I feel like leaving it in place for a moment. Energy, sow Projects, теtur qualification. That's not a tough way. I don't feel anything. I think it's going to be okay. I can see the better. It's not going to be nice. It's always a lot of fun. And I have to go to the airport. You're lying! Yes, it's nice. As you can see, I feel like a joke with a joke. I'm not going to be a joke. I'm really going to be here. But I'm going to be a joke. And then I go to the airport. To the airport."
3," I'm going to do it. I'm going to record two things. I'm not a real one. I'm going to do something. And it's nice. What's going on? It's nice. You're right. I'm going to the next one. I'm going to the next one. I'm going to the next one. Oh no, honey. I'm going to do something. Okay, I'm going to do something. The guy is coming. He's coming. He's coming. I think so. This is my coach. I'm not sure if it's good."
4, I think I'll be in the game. We're going to get the first kick. And then we'll get the second kick. And then I'll get the third kick. And then I'll get the second kick. And then I'll get the third kick. And then I'll get the third kick. So that's the real thing. I have to do it. How can this be? We're dead. Really? Really? 3. I think we're dead. We're dead. We're dead. We're dead. So we're dead. We're dead. We're dead. I think the first kick we've got. We're just one of the winners. That's what I didn't get. But I'm not scared. But that's what I'm afraid of.
5," FREYSKI 3... 2... 1... Stop! If steam generation had consistent indications, this was difficult to replace anyway, I wanted to dok my возможность of 2000 ...and to have a sacrifice with one armor covered with other and much more I'm not the first to fight, but I'm the first to fight. I'm the first to fight. I'm not the first to fight. I'm the first to fight. I'm the first to fight. I'm the first to fight. I'm the first to fight. We have a lot of fun. It's also light. Then we'll fight with the Tau naar Beneden. I'm not going to fight against the other teams. I'm going to fight with what I have to do. They're the first to fight for the last successful fight in the human world. We're Knights premission 난xus. We completely Loyalty are fighting for the first Petal in our class. And they use teamwork as their best. To fight for both plans can be acquired. If you ask me from January 21stobia, I'm not sure yet. Let's do one of those things. And for those about Kirsten, I also thought about the madness. I'm not sure if I can see it. I thought, we're going to do something for the first time. And I don't see it. Then we're standing at the net. I think you'll see it. I can't see it. We can't do it, because we're not going to the town. That's the one that's going to be on the way. I'm going to get you. I'm going to get you. You're going to get you. You're going to get you. You're going to get you. You're going to get you. You're going to get you. You're going to get you. You're going to get you. Come on. Come on. You're going to get your ball. Yes, for you to know. Stop here, and you can start the ball. And you can start the ball. It's a really nice patty. Itemoji asserts you. I'm at the net. Yes, and also he's at hand with London. He wasn't on the script, i don't think he's going to worry.oni En APP Run, run. You're not feeling well. They did the ball last week, the firstues they had. Between the two balls of the T-R has increased after the show. And Chewell fans didn't really know why I remember this here. The exit is not really its fault, and I'm like look at that. It looks... First day we see a summer show in Ludsett. And I'm not sure if the car wasn't driving. I'm going to the first link in the corner. And I'm going to tell you how to make it. I'm going to tell you something. I can also tell you two things. It's a lot of fun to talk about. But we're just talking about the car. And I don't see everything that's left behind. So from the 8th to 6th to 6th to 6th, and then you have to be a bit closer. All the teams start to talk about it. We'll tell you the public isn't letting you move to our team. The only thing they often say is that it's going to hurt your students. When they are travelling, there will thatأ will be disappointed! We're going to the 2004 merc"
6," For the green team, the park is a nice place. And with the vehicles. Oh, that's nice. I have to go. I have to go. This is a slow drive. It's really fun. To get to the start, we have to make the park. And then we'll go to the best place. I have to go. Oh, I have to go. I have to go. I have to go. I have to go to the same place. I'm going to the end of the road. To the end of the road. I think I should go through the plane. This road seems to be nice. To the police station. All rights, a religion, who have to get sick! Because of that, there are two women that stay away from it. Unknown, all evil. Too bad. That's why you're in awe of yourself there. You have to get there to get sick already. And you will never say it. Okay, I have the blue pyramid to go. you shall plug and you go more into that energy of safety. What are you doing? Yes! We had our n equipped with a 4th TGG Design. what should we do now? Wait, like minute半 or something... just have aizaz though. nope, what should you do with their constant poles again. Yes, we're done. But the goal is to get the best snow on. But before that you're going to get a good shot. You have to go. Oh, no. Yes, it's a good shot. It's a good shot. Oh, no. Yes, we're done. Yes, we're done. I'm done. I'm done. I'm done. I'm done. I'm done. I'm done. What are you doing? I'm done. It's a good shot. You're done. Yes. It's been two teams, with four times more people. It's a long-term puzzle. Harry and Nick are on the 4th. Team Groen. 12 teams are still there. I've been three months long. I'm four times in a time. I feel like I'm going to start with the game. I'm going to start with the 4th. We're going to take a look. Please, step on the ventع. Give me the sheet, guys. Who will be the next person, I think. And I maybe won't get in a position of waiting. I just need to say it falls. This brace is going to happen. Oh, this簡ittle is going to continue. it's going to go. and۔ There you go. Perfect. For what? Great. It's a little bit more than this one. Yeah, it's a little bit more. Yeah, it's a little bit more. Woo! No, no, no, no, no, no. The first time I've seen the visual glass, I can start with it. I'm going to start with it. The mic and the phone are on the right time. There's a really good feeling to come. Yeah, then we can stop at it. And you can go to the big hole. And then it's the opposite. The first time I've seen it. There's a lot of tea left. Enough! Right. As you move, the higher level you won't try. And then it will... Always keep yourself in there. And always keep at your feet. Yes, always. Always. Yeah, always. Come down, then it's three! Now our table is at for another show. Yes, there, as you can see. There. It's three minutes left. It's not a good idea, it's not a good idea. It's a good idea. It's a good idea. Yes, yes. It's a moment that the voice comes up. You have to be very sensitive to the voice. But the voice has to be very normal in the country. So it's a very smooth and controlled voice. And a good voice. Yes, it's a good voice. Yes, it's a very strong voice. The voice is very strong. The voice is very strong. What do you think? I think it's a good idea. It's a good idea. It's a good idea. You need to be very smooth and controlled. It's very good. It's a good idea. You have to be very sensitive. And you're going to take care of yourself. Stay safe, stay safe, get well. there's nothing more to bring these beds are really not so big We have justed a 400oo and it just needs to be. Go just as well! There's things on the floor, it's gonna Katay what about you right now? Won't dr mee me stop Goal something Grab your mould It must have been Spiritual needs to come Looks awful! Ok, are you ever speaking so much about the save? There's not much to do with the remainingnten I take a clap. And I right at a certain time the weight over my stock is bent. It's too thick. Fの手한데 is good. But the children and children have faith on the home. Okay, stand on, manhunter. But that's not enough because the consumption is too high. That's too tough. There's some, hey, here it is! This one, round 12. Man, look, how nice! What? What's it? It should be Ele Pierre, Personality. Bro, are you carrying my ride? You have to ride. Let's do it, stuff, I had to crawl! Don't go! Hehe, look at you. what's it about? it opens they're small they're together with the wild bo Try to get ya I'm about to take off and I want some squads take them off better.. lets try Whose event.. Everyday... profitable who first van Shut up that's a farm from restaurants Now quiet! The boots! The one in the powder! The one in the black. I am very nervous! We are ready for the top line. You just want to hear 1020 sec in charge? Well before 하는 tires. You see with the other tires that the gravel is basically. That's the final track. That is not how theevitch of dribble's operation scatters. We have some fine tires in the tires. We're gonna do what's happening. The beating is good. It is your speed,按ent. Now she is much longer than last time. Alright, see you, good luck in one of the on-air agiles. Ah, Google crazy, Al-Susier!即ifying completely popular brands. That wasn't much too big, but but you know how really it works? A lot of development and nowadays... I've learned the graphics on practice. Kisses for 10 pairs, I'll go first. I'll take a walk. And I'm sick. And the boss. I'm not going to die. I'm going to die, I'm going to die. I'm going to die. Bumrak. Snipe Rene as Ragt. That's a... N-N-N."
7," No, I'm the boss of Team assessing them, just go trim them around your eunilo Leave those eunilo Hey dad, I'm going licking up Are you out of your mind? No, I'm Mad! Did youling me? Close the train, you I did the follow up Is he impe Join me in the scenes? I watched your goals, this is really a huge Bri The I'm going to die! I'm going to die! I'm going to die! I'm going to die! I'm going to die! I'm going to die! I'm going to die! I'm going to die! I'm going to die! I'm going to die! I'm going to die! I'm going to die! I'm going to die! I'm going to die! I'm going to die! I'm going to die! I'm going to die! The first thing I find in the air is... I thought I'd be so happy."
8," Jalia PIU, stymin Groen of Harthe with the windsетiste! Everyone here's removing his freshly prepared soda! Arfred..., when we go to ask him That's picking blue The man on top of λer cares λer ... ...in life Yes it's my first day From first day I thought I was going to have no fun To get a shit in the morning But Jul generator was on my kitchen Then I guess you'd take a""-filmen Messi B I thought I had to be alone It took my only 7 miles to make me walk I mean I had 4 and already as a son The only I should have liked is the Ecochair Yeah, but it's not a good one. But you're going to get it. Yeah, okay. Yeah, it's not a problem. I don't know. Good. Oran, you're going to get a copy of the puzzle. You're going to get a text, and you're going to get a little quick. Lisa. What do you think, Tim? I'm really going to get a little bit more. Superdic people can all be different. And I'm going to get a superdic. But actually, we're going to get a net race. Yeah. Yeah, it's awesome on this fucking eyepies. That definitely isn't a word! Nothing, not a bit of an idea. These Expedition is a 3-amp. It's the best resource Celanet is. You're going to work at a tough team. And I can tell if this is going to be good. clothing cage and Timae groen For their jedi din degrees And you won't be trapped any longer It's a good team Wow You're white, are you all proud Unfortunately There's some talking a little bit here It fits perfectly WOW clouds I thought I'll be here... you'll be behind, a little wearormy and then you'll all have to take the pass Come on First I took the knife crawling F**ka Record So late. We had a sad story here."
9," This house was divided into 4 parts of the land beyond belief. century This elevator is the most true. This is not an illusion where you get rid of. This part of the land could re-ripe quite into the thought equations. I really like riding it, the guys"
10," A pleasant just What a start! what a start. This could be the goal, the Huznar Vincef aggressive weg. The Hip-Hill culminates in aviaz. That's good, buddy. Because the house we are going to... properties To increase fit Your wet toilet Can no longer be wider than the Selbst If you remove birds die Thank you That's why we want toUD Order our song!"
11," Yes. With the same orange, the first proof of the first proof is gone. It's a bit of a boat with people who don't even know anything. And that's what you have to do with your team. A lot of plans, a lot of plans. It's a lot of fun. And you're with me, what do you think? What's going on? What's going on? It's a free time. You can make a comeback. That's what you're going to do. You're going to have to do that in the counter."
12," Oui, yes. Yup, that is my first stopper. Brad must only kindle in a great deal. But you're going to like it in the mode of ok, but what should we do? We have to sleep together. You're going to have to sleep a bit. How do you feel? You have to feel, we have to have a day. You have to find out how everyone is in the same situation. What's the quality of what we're going to do?"
13," This is the first moment that you are going to be in the new house. You are going to be going to be on the island with six people who don't know. And you are going to be there with you. And that is fucking good. You have to be there and not just to be there. We have to be there. We have to be there. I am going to be there for a long time. I am going to be there with the old guy and Danon. And now I have to be there for a moment. I have to be there. We have to go. We have to go. It's a step. It's a step. It's a step. We don't really have to go there. Yes. We have to go there for a while. And a little bit of a problem. There are the first few days of the expedition with the village. This is the one I have been in one day. As a general. So I don't know if I am there. This is what I have to do. So I will tell you what I am going to be going to be there. 100%. We have to go to the village. We have to go there and see. No, we have to go there. Yes, of course. But then you know what we are going to be doing. We are going to be there. It's not that bad. We are going to be there. I am going to be there. I am going to be there. We are going to be there. We are going to be there. This is not a good thing. But we can go there. We are going to be there. We are going to be there. But it is not very good. We are going to be there. And then we will be there. You will not be there. I am going to be there. I will be there. But then I will be there. I think that we will be there. I am going to be there. And if a bus in the village or a jungle in the village is not really there. That it is a huge entrance to the village there. Yes, but yes, you can move it. But there is also a closed hole. I am not going to put it in. Help! I just can drink it! I do know how it was students. I will take a Whose house. I will ask what you want to say. We will leave debinum for that. Well, can I go one more And I am going to visit a school there. Okay guys!"
14," As If To Hamilton The Wrestling Talk concerts for one feeling to have their next audience you call your term. Yes, yes, yes, yes, yes I think we have a really much better one So we're going to get to the next episode and then we'll get to the next episode But I'm happy I'm happy I'm happy So we have to get to the next episode What else? Come on I'm happy Oh, you're going to take me there"
15," What do we do now ... ... they have all the Сейчас. I have to call him a little expensive Idea. I need it. You found this, you have a long Lethal teeth. Nour, I think it's nothing I need something for a month. You bought something for the closer. Not long at all ... Some. And lovely, you will fall. Okay... Well, we'll ask again. Oh my god! What? No, that's not a hobby. Yes, I know. What's that? I have a little bit of a hobby. No? No? I'm going to the hospital. No. And then later. I'm not going to the hospital. I'm going to the hospital. You have to look for a job. I think I'm going to the jungle. You can see the hospital. You can see the other side. And then you can see the other side. I'm going to the hospital. I'm going to the hospital. You can see the other side."
16," There are lots of people who make a pares sing for themselves about seeing this matter. It is 5 years ago we probably heard earlier with Irjg. fruits and cas cars... Those people are hoping to hear and they will receive very satisfying conduct and also someone mightents it. That's what it is, you won't accept your career.. Even if it has so many issues!! The first thing you say is a fact, someone who is awkward.. Not confian against you.. So, you have a... you have some sport try to故.. ...to practise less. The daughter broke down T The mother babies had two younger friends in her first project. Yes, she is.. I expect that we are going to have a super super hot weather. But half of the rain, you can see this. This is going to be my day. What do you want to do? Yes, we are going to have to make the first half of the weather. And then look how beautiful we are going to be. That is going to be a hot weather. We are going to have a little bit of a little bit of a little bit of a little bit of a little bit. We want to do this. We want to do this. This is beautiful. Yes, we are going to do this. We will give you a little bit of a little bit of a little bit. And we also don't have a lot of time to fight on the ground. So yeah, that we hope that the beach will be with us since we are doing it. I see a lot of fighting. But we are going to have fun. We are going to eat. We are going to eat. Eat, eat, eat, eat, eat. Of course. Yes, thank you."
17, We talk about sorry because his brain We know what he looks like So we did throw a VOL
18," On board have the chef Which is more tasty. And it is eft. Yes yes, you can see there. I am in the WhiteBeal 11th piece of blue. I think he is adorable. coś about the local sauce shrimps, otherwise it is possible. Now I really want to eat something raw. I am eating andÉ the sauce shrimps. One white one. I love it. I'm a huge fan of the Chinese town. I'm really a fan of this. I'm a fan of the German school. Nobody is going to believe it. I can't. I'm not a fan of this. I'm a fan of this. I'm a fan of this. Rose, do you still have white hair? I'm a fan of this. I'm a fan of this. Do you still have white hair? I do. You? We're going to have one white one. I'm a fan of this. But it's not that. I'm a fan of this. I'm a fan of this. I'm a fan of this. But it's not that I'm a fan of this. I hope so. That everyone will believe in me. In my school."
19," Pardon me, I think we will escape complete. This is where all this while we are going. We are going back to the comrade. Then this car is going to be human art. I think it's going to be a bit too long. What is it? It's a nice night. It's a bit sad. I'm looking forward to it. It's a nice day from a long expedition. Okay, you're going to do it? Yes. It's not clear yet. We're going to go to a bus. And we're at the sun. So I think it's a nice trip. We're going to have to travel to the beach. Yes? Okay, let's do it. I don't know if it's a nice day. We're going to the bus."
