Segment,Translation
10," Over Long days, number check. In the wonder's боimiality of that the time was lost seriously. But this was definitely not the case with the village extension. But, the deputy teacher was not very sure that they could not do everything. Oh my no ! Oh. Episode over. This is a weather forecast. That already happened in a Case of Stelde at a Autosturmerst Scaler. Theあとile means 83 visas, with 23 greetings. You'll sayaci's are a lie and we have to say hello. We won't know and what he said. Check that구ette is remaining. at the taste of this sun. thats it, it also goes to Water as a start. You're pretty amazed, it needs to make a lot of noise and ensure that I find a place where I miss you. Imagine, even if I hasn't received the treatment... it's obvious what I'm wearing. C Stew for 3 weeks All right! She delivered the home, suspected of going on it himself With this party we have Toe So she lost! Why are you here anymorena? Like she hur著 the door And she found me And this show in hisied room I really love the moment of dawn. It just keeps it this way. If you have even one left forっ, then at least do it in it. I love the moment. I knew of that는데. For everyday life is insomnia. There's nothing left to deal with. You're a tough man! Are we at last ones. I cannot get the rules, because if you don't have it. I become british until I signs it. A hard day is massaged. ...you're doing his own business too. He's not getting used to it. Nobody talks, but he's Poorso!"
11," One thing was a landing. Not a normal one. I think it's a very good one, but this one is really great. And we know that 100 kilos must be taken. It was really good. It was also a team owner. It's a bizarre pose. Hari, you're saying, you're a guy. Yes. Yes, that's true. You can be very good. Yes. That's true. Yes. One is very cool, but it's a bit of a difference. Yes. I don't think it's a difference. It's really a lot more interesting than it was. Yes. We're going to stay in the jungle for a long time. With a team. And yes, it's a big fight. But... Yes, that's true. The idea is, it's a challenge for the orange team, but it's coming to the hall. That's a good one. It's a very beautiful, very beautiful. Yes. Yes. I think it's a little bit more fun, where the day comes. And that's really nice. Yes, a big, excellent, great, great island. And especially in the Pacific Ocean, for the rest of your life. The weather is cool, right? A small trowel, too. Yes. And really nice. Yes. As you live. It's not about the focus, it's about the pleasure of this young man. The safeguarding of the island is the way it is, and... would you mind for the second one?"
12," To get to know you can't make a decision on a island. There are the things you have to do. Sit down. Sit down. But you have to wait for a day. You have to wait for a day. I think you can sit here a bit. But... You have to wait for a day in the jungle. I don't know if you can wait for a day in the jungle. You have to wait for a day in the jungle. I don't want to make a decision on the island. I don't want to be a bit more. Yes. But you don't have to wait for a day in the jungle. No, no, no. I don't want to be a bit more. I don't think that's what I want to do. I don't want to be a bit more. I don't want to be a bit more. I sit here a bit more. And while I sit with the smile on my side, I have a lot of things to do with the distance. I don't want to be a bit more. I have a lot of things to do with the distance. I don't want to be a bit more. I don't want to be a bit more. I think that's why I'm going to do my own thing. I'm going to do a little bit more. I don't want to be a bit more. Yes. It's 3.5. Yes. That's a bit better. I don't want to stay in the jungle. I don't want to stay in the jungle."
13," But then, we had lots of electrics. It has been tough to get fish kicked out. Just fine, happy Audi. And my name is Keiber. We have seen the San Francisco bicycles everywhere. So tired, but I. I'm not sure. I'm not sure. And how much is it? I'm sure. But what do you have in this experience? It's a very difficult experience. You can see where this island is going. What do you have with the car? This island is where you live. Well, for you, it should be full as if you're in the valley. From a beach. You can see people like you. I'm telling you. I can tell you. I can tell you. I have three. I think I've got a lot of questions. But this is coming. A lot of questions. It's easy to feel that you have a lot of stress over a island. And that you can stay in touch. It's a wonderful feeling. Oh. What do you feel? I don't feel it. No, but."
14," I'm going to the next one. I'm going to the next one. I'm going to the next one. It's a long way to go. Yes. Yes. Yes. It's a good idea. I'm going to the museum. I'm going to the museum. I have to go to the island. That's a good idea. Then we'll think about it. Yes, that's true. We're going to the next one. With the help of the ship. And it's a lot of fun. But we'll go to the next one. We'll also go to the museum. Yes, I think. Okay. I'll go to the island. I'm going to the island. I'll go to the next one. I'll take the Swedish Spanets. I'm going to the tourism with a very nice place. I'm going to the island. Because of this one you need to go to the island. Right. Right. Oh, the city. To�yyy module. We have to calculated on this island. Finally our last trip. That constellations could create a fits- 진행 to the ceros. It looks like the roller coaster. On theeddow is big so we are going to go't available. Yup. I think they all respect Groke's temper, is it aaand painful? I won't pluck the bait to make it clever 341 Oh, that was great There's a big hole in the Bend. He's going down again. Now they're going down in the Justicelever drugstore. Yeah. And after that he's able to walk in the Grand. I think it's a real thing, because the team is a joke. And I think we're going to do a lot of things like that. But that's what you do. What do you do with that? I'm still a little bit scared. Are you scared? Yes, I'm scared. Do you think so? No. I'm afraid I'm scared. Everyone has to be scared. That's fun. So when it grows, my mum is soon asleep and visits us for that anyway. And the other way is, in there, places that isn't! The scene, towards the fast Silicon Valley, is a very beautiful film inside. It sure is a continuation of a系統. You know my героa and the beach. But I've got to be on stage. You should come to them for the first time, please. Here, I'll come again. That's your room right now. Oh, Harry, Harry, you have a nice heart. Yes, I think so. That's a good job. I'm from the back. Yes. I thought it was a good idea. Yes. I think it's a good idea. Okay, what do you think? And what do you think about this emotion? Yes. It's a magic. Does there be more of it, that that is Alzheimer's, my little Germany Zip? It's not zippers, it's what I think.lass-eparty or for it's, it might be. That there's also a backpack underneath of it, it's making those foods a lot. You can always pack a string to show you. Although thisLaughing can still be used for at least So as long as, they're great, so they're great. Yeah, just enjoy. It looks like they were singing below. They existed. Faith beautifuled men. It was a long, long, long history. Good times in place two times. And super cool always. One time they got worse then we could say goodbye. Please, ETim, I'm going to the конце dibellosa, because it's all 3. Wait,出來 that I and Darre, and I don't get to be smart, whether rich development, how do I do it? I behave differently together, but I am a sãon beiden sometimes. I think there's a purpose. What a leap! What I think, forás, things similar to each other. I say that I will, cause my foot hurts by a bad chance."
15,immer 1
16," Two hundred times over the bp Thank you Do you have a seat But you don't have the money. It's all exciting. It's a nice game, people don't know what you're doing. You don't know. I hope for the best. I want to be a star in Tim Hau. We're going to be a star with six. And it's a star with five. Then I have to be five stars. I'll be there for a few days. Yes, I'll be there. Good plan. Good plan. Yes, you're right. Of course, I'm in the same room. I'm sorry. That's good. But I don't have to go here. It's a game, it's a game. And I'm going to take my points for this. That's my choice. Not with all my life."
17," .. Team Piao is arguably the swallowing demo of TUV .. at its final features analyst van tuis then knows who will be in the last 10 weeks of your full interviews. To give you more information, let's go. Oh, hopefully. You can hope your experience come to us next week! A two-week live in helps make everything easier than we do. Good afternoon. What are you doing? I'm here to find the best. Have you said the proof is okay? Then you'll get the best info on the island. A broken whole A bonnet foot怎么了 Is that true in an engine wheel? And a car flew on one move Go with without 1000 MP Tense moves Should I land on the ground poco? You couldbed against everything It looks like an emankind Whatwać astray? It's really nice. I think it's a good idea. That's what we really need. So sit back and relax. Isn't that a nice feeling? No, that's not. And this is a fun experience. How can you feel it? I feel it. I think it's very good. But I'm going to... ...to get a lot of good things. So you know where the landing is going to be in the landing gear in the Sandford. One with an immunetylch moment, one with an XS-stem, and one with a blender, and a slightly more appropriate one. With the blender, you can use an immunetylch moment or an XS-stem blender. London, I don't know if you know what your cooking skills are, but maybe you're the blender. Now you want to know what I'm going to say. No. So now it's time to..."
18," Good. You're always in need of your system. You're going to see how you've got it. But you can go and ask questions. Maybe the immunities in the museum will be in the museum. No. The first system. Ferrari. The third system. It's for Gersen. The third system. It's ok for you, Gersen. The fourth system. The third system. The second system. The third system. The third system. The third system. And the third one. You're in the last system. I'm looking for you. I'm looking for you, Mr. Stemmer. The doctor is here. I'm looking for you. I'm not very proud of you. It's good. It's a moment. You have to tell me the truth. I'm going to miss you. You're doing great. I'm so happy. What's your plan? I'm waiting for you. I'll ask you a question. Thank you."
19," I think... You could tell who will be first. I want to invite you to be more interesting to see him. At least, you need your expectation. I'll anyway cast that in advance. No matter how badly it has been. We all know where all of them is doing but it swed a long time back when people sort of know whether they were coming out and seeing. That's what I think about life. An odour. Sir. You can set me up with an island. Yes. Hey, Ivan. So is again someone of this lucky employee, The Piars Team delivers tryaway They catch a serious check on the 2nd name of the team In the same team, we'll find solutions In the less워 I create. I can look for one by two represent that Next is a days after all Piars The people envy us He will take it He needs to change for how? Okay. Do you have a clue? The first. I don't have a clue. But it's still possible. Chatele. Hello. Hello. For you, it's here now. I'm home. I'm home. I'm happy with my baby. It's still a little bit cold. Thank you. Thank you. Good night."
20," What do you want to do? I'm just going to be in the sweatstrike. I'm going to get a little bit of a loss. You can. I'm going to be in the sweatstrike. You can. You can. I can't see the consequences of Dennis. And I think my story is really... I'm going to pack it. I'm sure I can do that. I can do that for you. Oh, shit. What the fuck?"
