Segment,Translation
0," AND DONG I have lapped up here, but at the venue, especially I'm afraid there is winds I'm here now, to do something new. While I ask the truth, I'll turn the Boydry protect themselves. I see some én Buddhas and some ouais offtail. The unsuspectable ones. Why isn't it install on today so far? Don't im imposible. To get an emphasis on photography, I'm going to increase my effort, into Cinotype Anna moment in my life. I think that images can function in Spanish as well."
1," marshall grass falls and then governor Where does it take us?ière Yes , then dispersed I was very happy. I was thinking about what you thought. I came from the small slurfs, which was the beginning of a house. This was a water house. Wow, that's a lot. I was really happy. I was really happy. Wow, that's a lot. It's a lot of stress. Wow, that's a lot. Really nice, fresh water house. Then I started my... ...metro-loge, because I really like the club. That's nice. Yeah. So nice."
2," THE LAJER I believe you are At least y smartphones do it. That's where our energy distributes for vaccts. This speech has been integrated with our poor nature... ...to谷 things that we still do a few days ago. We open our curiosity... and back about our hard times beyond our scientific orbit. That's what the index winner says at the pointlebjes, can connect some features that help us out already. Spotify, I'm looking at the car and I'm looking at the car. But I think we're still in the same position. That's a lot. I'm in the same position. And then I'm in the same position. I'm in the same position. And I'm out. I'm in the same position. And then I'm out. Yes, I've seen a lot of people who are going to do it. 4 years old and I'm going to go to school. And I feel like I'm going to do it. And I'm not going to sit on it. I'm going to go to school. But I feel like I'm going to go to school."
3," P You're really important. You're always in the mood. I'm also in the mood. It's really my fault. I'm not really sure. I'm just a child. I'm not sure. It's so awkward. I'm not sure if I'm going to the ball. I'm always in the mood for a long time. The description is totally not mine, but the new FNH group is what it is. I have to do this to the captain. Pain is temporary, glorious rubber. Max, Max is dead. He's coming. He's coming. He's also coming. I'm hoping you're here. Yes. Thank you. You can do it. Thank you. Bam. This is not what my life is going to say. So the pressure is on. Yeah, this doesn't work. I have to win. Yes, I'm winning. Oh, yeah! Let's go, FNH! Yes! Good job. Good job. Good job. Good job. Good job. I've been feeling better for this battle. I think that it's really a life experience. I think I know what I'm going to do. I can win when I think I'm fine. Because we're really a bit more tired. And I think I have to do that. I think I have to do it. I really have to do it. I don't give it a single step. But I think we're going to be a striker. I think. I think we're going to be a striker. I think we're going to be a striker. I think we're going to be a striker. I think we're going to be a striker. I think we're going to be a striker. I think we're going to be a striker. I think we're going to be a striker. I think we're going to be a striker. I think we're going to be a striker. I think we're going to be a striker. I think we're going to be a striker. I think we're going to be a striker. I think we're going to be a striker. I think we're going to be a striker."
4," Dipокatechant,ArtlerQWWelcome to σε4gvetlène After half an hour you might be hang this. The locals van Appräoole is pre-filtrejäth honking I'm playing Hai special-Josh Morand, it's one of the checkpoints available today. The guide wanted to let them be the best. So with once more water grew high, wind gradually appears on this stage. And it sounds like this, but I think that that's like mental health. So indeed I went through such aogen. THE ECs Hafen"
5," So, they put your coat on them not to blame on— bring it long for people. Get out from their groups. Bering up is difficult. This is my pick-up work where you can get on the car and catchup. And there we have another 22-hour drive out there. My next target is Close во hill for a должен lick this b unknown nature. That's a good position, on the race track. We thought that it's all way best to work today. It's perfect to work on your work in a field. I guess it's always great. It'd be interesting to get that well over there when you can land at a Parks Lake National Stadium And I love how it was driven here on the C味, and I've got a religious gardenLDom in particular that stands up for my expertkm English modeling industry. Where's Thabs? About Amelia assembled. Tony-Zielsenis's uncle. That is how we both understand. I won't be able to make it open anymore now. when someone knows keep warm, I start with some family to think and all some people gonna and find out the reason why I usually feel like that I'm not comfortable. And sometimes, your body just ends up with some really good vibe so it will be better with a bad name. Let's have a rest of the minutes Half of. It began to go to the beach I think I'm going to get into the car and I think... Oh, I'm going to get into the car and I think... It's going to be a little less. Yes, ok, that's one down. I'm really scared. I feel really scared. I'm really scared. I'm really scared. I'll get started. Now they'll try aución. They will close the blue sphere and make the sea up-the view. Another route I think will order 60 centimeters of number nine from Monday. So that does a bit of sunset. I didn't get the pin. It seemed to lead all sides. Let's тобой the promise party in the midweek 9 minutes. Here it is. I don't do that with pleasure. But I'm going to drive. It's not the way you're going to get 20 minutes. I'm going to drive a little bit. I'm going to drive a little bit. I'm feeling at my right hand that you're going to get a little bit. I'm going to get a little bit more over. I'm going to think about it. I'm going to be happy to be alone. I'm going to be happy to be alone. We're going to drive a little bit. My Benet is doing something I don't know about. We're going to drive a little bit. I can't believe it. I'm going to drive it for a little bit. But I'm going to drive with the wheelbarrow. And it's really nice."
6," The Resistance, even God knows. Just like a rule of ours. You think it's something you don't understand seriously. Just how much you drink. What are you talking about? Why can't we get this? Mu-2 for a hundred euro. But if Turkey really pours something, we have to pay first, and land on the prodigal."
7," GLAM Portal We're alone here in Highland. Timo One. I repeat, that's what I'll do Vindcenterhet. Visual has been useless for me, The second headed sign was also dominated China. You can see David highinters here and he says! Last week I thought that exploded, so it was one day this afternoon. We got to a place where it was not as clean as we thought earlier."
8," Well, let's keep on going to sleep. Of course she is 12. There's nothing between the gym and sleep. You can go to Christmas party when you go to Friday, shoot... They just got in like a 6... Would you put two matters up at one're you to the sick right now? I guess you think it was.. That was already really cool and I know it's all over again. The 4th day of my day to go back and go back... ...to woo you very much. And then you're going to get a kiss. Oh, and you're going to get a kiss. This is it, you can kiss. So two very beautiful kisses. Or kiss for one of the three co-workers. In one seat the plunder, in another seat the next time. And we're in another, an immunetylchman. I think the answer was, that I would like to make a team. And I think, yes, I'm going to make a kiss from my brother. I'm going to slap him first. And then, as a co-worker, I'm going to give him a kiss. And I want to give him a kiss. This is what? Yes, it's true. The reason why I'm here for the rest of my life is to be a bit... ...same. You're a little... ...and you're a little... I think you're going to get a kiss from your brother. You're going to get a kiss from your brother. And you're going to get a kiss from your brother. And you have to be a little bit more motivated to get a immunetylchman. Yes. You're going to get a kiss."
9," There's something to it! How am I supposed to do this? It's really simple to do it, so when this goes to it... Where would our otherOpen find this kind of sign? I've got the other sign.. Right.. Once we have the sign妳 come in, Steinpakse! Where the Cosdoceswell three times see the sign... Hang on, and we'll go there. Peter, Peter, Peter, Peter. Yes. Vincent and Tiva, I have been together for a while. But it's really close to us, really close to us. I'm not sure, but I'm sure we'll see if we can find it. And maybe we'll find it in the island. I'm not sure if I can find it, but I can find it."
10," Welcome to the public! Take a walk! The 11th century and was really stupid! Guys, they have come to Africa. Hi. With my face spring is tastier. Hi. Share with your friends head. Its a bigmer, so only .. It's only two times, or a poker. It's just a poker bag. You're going to have a better time. I'm going to have a stay here. Good luck. I'm going to have a good time. I'm going to have a live on the street. I'm going to have a good time. I'm going to have a good time. All of them are tired. I'm going to have a good time. And there we go. If you want to be a poker, you have to be a loser. You don't want to be a loser. You're going to have to be a loser. I'm going to have to be a loser. Yeah."
11," Off your feet. Wherever you 어디 to mid this is. He came to see me all the time. He started to probe my apartment. Now I have a clue he will keep on going over my bedroom. And back to your bedroom! No no, reasonable note. Fuck it! Oh no! I'm going to the one emotion in the other. Oh no, I'm going to the shitman. What do you think? I'm going to the better. Who's there? I'm going to the hell! I'm going to the hell! I'm going to the hell! I'm going to the hell! I'm going to the hell! It's the same thing in the world. What? It was so hard. So hard. Oh, that was so hard. That was so hard. That was so hard. Okay, so I'm going to tell you. Otherwise I'm going to the hell. Where did I have to go? Yes, I did. Yes. And that was the E-Pro and Tiva. And you came with a balloon. What kind of kiss are you? And you kiss. So I'm going to the hell with my mom. Then I'm going to the hell or not. And I am going ahead with my rest amount of money and for a good decision. Hey, kids! Don't worry about the boys! I'll get you some two, one.哈 animals with the 돼 and the auntie! Then my dad suddenly called me. But the only thing I can count for is, but I'm going to find a way to do that. And shut down and you're going to follow us again? Yes, and every time I don't know. And yes, and I just have to stop there. Got you? Do you know the rules? But you know that I'm a man. Yes, but I can do myself. Yes? Okay, this is good. Okay, it's good. It's good that you don't have time. You don't have time to do yourself. Yes? Yes, that's good. The competition is different. Oh, great. It's great. Wow. If we know someone's problem, we can do it differently. Oh wow. That's a nice feeling. And a nice feeling. That's nice feeling. The big, the real life. And the control room, also to me too. I'm really excited. That's new, 4th. As a child. Yes. So we're going to the team west. We're going to the competition. We can do it. Yes. In the park and in the way. We're going to the competition. We're doing a dance. We're very happy. And we're going to be a real comeback. That's what we've done. And we're going to be a real quick comeback. That's what we're doing. Go, come on. Here we are. We know that we're going to a better place. But we're also going to be in the hope. So we're going to be a great team. That's what we're going to be. Yeah. We're not going to be a great team. With what we're going to be."
12," To the heart... If you feel we're ready for the course challenging the Nords to Japan, would you say it's been a long time? That learned my education with myoka... I think I'll feel brave now. I'm going to buy a little bit of a boulevard. It's a nice place. Do you like the bank? I like the bank. We're going to buy a boulevard. That's good. Oh, wow. Look. Oh, look. I'm not sure. Wow. I've never seen a beautiful girl in my life. I've never seen a beautiful girl in my life. I've never seen a beautiful girl in my life. I've never seen a beautiful girl in my life. I've never seen a beautiful girl in my life. I've never seen a beautiful girl in my life. That's what life looks like. I'm going to stay for the next week. Actually, I didn't really like it. Yeah. You can just take a look at your dreams and make me happy. Yeah, I like that. You'll tell them you're not going to be happy. That's all? Yes, of course. There's a constant pool parking lot at the bridge,出去, with that big би and the cameras are out on the avoidance of lack of rated on aだけ lake. I don't know what it is. I don't know what it is. I don't know what it is. I don't know. I don't know if it was so long ago. It was so long ago. The sun was so white. The sun was so blue. The sun was so beautiful. And it's really nice here. But it's just a moment. It's a boat. Oh, that's lovely. It's nice. The boat. The boat. The boat. It's a bit cold. It's a bit cold. The boat is not cold. Oh, it's cold. It's very cold. It's very cold. It's very cold. It's always in the same container."
13," Left ahead of the city Explitress думators, confusing fools something awful left School is coming, follow me Next week. So tell me! We met professionals again yesterday Like the K&H We saw you through when steering wheel is operating So that was nice What happened to you? Not at all Great What is that? Are these shoes Amazing Man Found y.. But as you saw you flying I'm not sure if it's going to be a bad luck. But then you know what I mean. I hope you're going to sleep with a warm water. I don't know if you're going to sleep. I'm not sure if I'm going to sleep. But I'm not going to sleep. But I'm sure you'll be able to sleep. I'm not sure if you're going to sleep."
14," Decided to fight at your eyes, remember I will become one of your long ones, this one is my last TNS for today I'll show you I need to be a وCinical people and then in the back I'll connect through them Yes, I think it's a good thing. You're going to get a little bit of sleep. I don't know if you can get a little sleep. I don't know if you can get a sleep. I don't know what to do. I don't know what to do. I'm not going to tell you. I'm going to talk to you. And I'm going to tell you something. I'm going to tell you something. I don't have a chance to get a sleep. We're going to be in the same position as the weather in the city. If I don't get a lot of sleep, I don't do that. I'm going to tell you something. I'm going to tell you something. I'm going to tell you something. I'm going to tell you something. I'm going to tell you something. Yes, there's my mother."
15," . So, how's the carriage? Oh, those mortars. One on the horse. And another one,ourt it. reflect on, raps to the dance. Well, I deeply enjoy the thing. What do you think about your children? Then we'll go to the hospital. Yes. That's long. Then you know what the truth is. And you don't really know what the people are. Really? Yes. Really? You don't know what the truth is. Then you don't know what the truth is. Then you don't know what the truth is. If you don't know, please, you'll be a fan of this. No, not a year. Yes. That's it. Hello, Rose. What? What are you doing? I still have one for you. No, I don't. I'm crazy. And I have to think about it. I hope you have a good day. And then you'll be happy. Yes. And you'll be happy. I'm a little crazy. And I think you'll be happy. I'm going to the hospital. Are you going to the hospital? The hospital? Yes. I'm sorry. You're going to the hospital. Yes, I'm sorry. Yes, I'm sorry. I'm so happy. That's what I'm doing. And that gives you a chance to give you an extra touch. Yes, touch, so. I have a good experience for my patients. The person who is the patient is the patient. The person who has a hard time is a good experience. So, I don't feel like I'm in the hospital. So, I'm going to the hospital. I'm going to the hospital."
16, I don't know if it's going to happen. That's going to happen. But that's not the case. You're not allowed to be here. I have a lot of questions. I'm afraid it's going to be a ghost. I'm afraid it's going to happen.
17," Nabila & how do you get to the Rec單al? Building a bicycle Gave some memories Immediately, yes we're Freddy As usual, thenLO Of course, we confirmed that P Big Cross was soon to help, and the future of lots of bigger production teams. We have some high chance from the victims. How about that difference? We've met some fans and from our举丞Такstrings. But the most important thing is what you can do, inevitable, because you're a player. But if you're a base together with the rhythm of the water, we'll be surprised. I've already seen because I have as a Ruby teacher at school. But you like that SYBDA. I want three different students. I want them to even communicate themselves. But they don't know what they are up to. When I'm living here together, I like playing at home constantly. Life is a life within me, and I talked about that, and then you share a lot of offers, customers and an organisation This is the only area But before we knew that... and I was in a couple of businessmen... and I just didn't want it to work together... So muchExper buyed it on the starting payout... ...as people like that in58 You wanted a red coat. Actually, I still wanted this job. It was me whom I travelled to Danish. I did it for September 20. Long time no see. I knew it. or I understand the structure of it still has been I hope you try .. .. .. .. Your hand out is impressive It tastes amazing .. .. .. .. .. And when the snow was finished… So we got on his way to Ross's show He's alsoардing The rain aquell me He's 17 years old And him who could f**k I'll see you. I'll take a vlog. I'm a detectivereat. I won't get to know your grandma. I love 영상을 here. Look at this. Szsss!desks, this one is forever... And now you're in the back. Now you're in the sky. This ex-phase animal smells so far... Here, I'm in the room. Between the heavens and the animals Oh it hurts so hard For a million different weeks Since you took the best of my heart I love the rest in peace"
18," To our Chico Campaign event and the institute, the high school and the educational community turned the stream in there. It's like the white sandpaper reversed between us. We all have everything who thinks I'm eliminated. I have to set the attention of the government. This isn't wrong. In any case, we let those people's faces continue to transform the whole nation. I think we can do it on the road. I'm not sure if we can do it on the road. We can do it on the road. We can do it on the road. But it's going to be 100%. 100,000%. It's going to be 80%. It makes everybody happy. This is one year in eso. We've all tried it on. They're very late today! Just put him back out. Have a good day. Are we on the Yuhran track, too? I am a heart Contman. Our owners are interested now. Ilya, you're the humorous one of the Apac von Duffrim. April thinks he can do anything. How do you overcome that? It starts to be the first part of it. That's how you're doing it. And that's what people think you're doing. You're a different person. You're a different person. So you don't have to look at people's image. You're a different person than you're doing. Yes, you're a person. Okay. So that's the image you're doing. You think that's the way you're planning to do it. Because that's the way you're playing. But it's not the way you're doing it. You're playing it. You're not going to do it. That's what you're doing. But that's what I'm doing. That's what I'm doing. Okay, if you're a bad person, you don't have to be a traitor. But if you're a team, and people are just trying to help you. You can do it. I'm so happy that I'm not going to be a traitor. You can also do it with your own games. But I can do it again. And you can also do it with your own games. It's not that we're out of the pit. We're just out of the pit because we're all fit. And now we're not going to be able to get on the server. But that's what we have to do. We have to do it in the right direction. I'm not going to be a good player, a good player, a good player. I don't know what to say. I think you're a bit nervous that you're going to be a better player. You don't have to play games. You're not going to play games. Since I'm a team, I'm going to play with it. I'm going to play with it. I'm going to play with it. I'm going to play with it. I think that this frustration is... ...and this is also going to be the idea that we're going to be the next one. That's going to be the next one. If you think that's the first time, that's all. That's all. That's all. You can just play with it. You can just play with it. Because we're going to play with it. And we have to play it. And we have to play it together. No, no, no. That's all. That's all. That's all. I'm going to play with it."
19," Nobody else says. Can we see them?ondenjoins breeding Welkerina Bodgarli studies. Those are the best parts. Bon appétit! And we had to put protestabapress. Doesn't it mean we were high-level elementary school students? Yes. If we add words he mentioned, if they're still dere exultant or not, in view like our team, He says that they're leading students and we want people to see for it. We only see within 3 days. If our decont NAT. Then we met Askel. And then, again. And then lastly,You once pass, Loft, Goose for us. So all of you have to leave there though. Because the moment one wants to organise your group the way our songs belong, and ready for this band. They'll give us your lovely answers, and please come back along. Finally, this is a pandemic. Yes, you know, although there are also no pretty cave, so you'll have to put your body to a tight track, We have to go into it. From today, we go to a local school-wise. What kind of situations did we have to do? Maybe we'll avoid that. I get more goals of picking them up. The first thing we could do is just not take the judge. *** As the boat levels talk to demonstrate the situation, international tense mourning, I have packed a lot. So was it having to do with my emotions? The fact is the most important thing. I can choose the solution to choose what kind of bank you could find. But Just missing one yanken mark every those days. We're hunting for three and mill year old L possible. I don't really like the team spirit. I always have the chance to do everything, and we'll do the fun, we'll win. I feel like I'm not going to be able to do that."
20," The orange team is on the edge of the campus. With Duncan Vincent, the captain of the captain's battle. The group team and the couple team are the last two ladies. But April and Jiva are the best. The team is the only one who is the only one who is the only one who is the best. This is the time to prove this. Team Grunt team Paris, welcome to the community proof. We are ready to see you. You don't have to be a member. What is the combat dream? We are going to the hotel. We are going to the hotel. We are going to the hotel. Mike, and the beautiful day of the day. Yes, and the person is really... This is for this 100%. I am very excited. Thank you. April, how much is the world you can? Yes, we have a four-year-old friend. We can't do that with the team spirit. So, the team spirit is not very good. But I think it's a good idea. I am 100% ready for it. What do you have? I have been a team member for a long time. I am a team member. I am a team member. And I think I am a team member. But I am very excited about it. Yes, I am so excited. I do not have a few days in the team. So I am not going to be with the team. But yes."
21," I love to tell you what I'm going to do. There are three targets. The goal of this test is to get three targets. But there you have your code. And as you see, the code is there. And that. You have a small plate. And with the four, you can just put one in the left. That's the code you have. So you think that your code has to be in the right place. And there is a construction as you put the code in the right place. And over the right place you can roll the code. As you put the code in the right place, you can go through it. And the theme that the first three targets have to be done. This is a whole set of proof. All is in the water, but there is also a lot of... ...we have a lot of elements, lots of things. And the only thing that's got to be done is to find out where you have to find out where you are. I think that's the whole set. You know, you can also put your code in the right place. You can also put it in the right place. So I hope that we can get the signal to the four. And that the data will be a bit extra. I think that's one, two, three."
