Segment,Translation
22," Three, two, one, go! The first half of the world is the first half of the world. I don't know if it's the first half of the world. As a wild You actually film a scenicеня doesn't normally assemble. Then I'll give theğlnoss to his eyes unripetent. I find itНАЯ easy to believe because I'mgai I think it is a relaxedly great course. Plato is a혀, fond of age and<|de|> forever, where he remains. Regardless of the weather theese are never expected. It's a trppie soеныak-fboom of wine. I thought, thanks. I'll show you my knierle om, because there is often glyphos in my knierle. The same style with the solar waste. We are here at the 100th of a day, so you have a team. I'm going to do that. I'm going to the water and have to do something new. That's small and we're going to the boat. And then I'm going to the boat. I think that the GIF is 50 kg. It's not super warm, but there are also other elements. It's a very water-like thing. I'm going to the boat and the boat is under my feet. I'm really happy. I'm so happy that my head is under my feet. I can't believe it. We're going to the boat. Are you going to the boat? Yes, that's why I'm going to the boat. I'm going to the boat and the line that you're going to do with the boat. The boat is right in the direction of the ship. We have to go to the boat. We have to go to the boat. We have to go to the boat. I hope you can do it. Yes, I'm going to the boat. That's what I'm going to do. Yes, that's what I'm going to do. I'm going to the boat. I'm going to the boat. I'm going to the boat. I can't believe it. I'm going to the boat. The boat is there. I can see the boat that's under my feet. I'm going to the boat. I'm going to the boat. The boat is really great. I can see a lot of space. The first boat is there. It's the way. I'm going to go to the boat. I'm going to the boat. We're going to the boat. I'm going to the boat. It's the boat. It's the way. The boat is there. We're going to the boat and the boat is under one boat. The boat is there, the boat is there. I think that's going to be a new way. You're going to go to the boat. Yes, come on. Can you? Okay, we're going to the boat. We've been doing this for a few days and we're going to the boat to the boat. We'll go to the boat right now. We will go next! Jeank Cape. Oh no.. Ian, I did not go further.. Oh IT is still the last pocket. Officers.nisse procedre Power. security. devil filled And Elia's petal was crying Will be an option. Bo Hind whisked. Arthur the S呢 The human was a straight arm and he thought it was a tendon. Really.. so close. Eal was part of him but he sat in my knee again. If it's a ball, then it's a ball. But I have to do it. Hey, you're a ball. Hey, you're a ball. Hey, you're a ball. You're a ball. That's it, you're a ball. Come on. Then you come to E-Motions and then you come to the restaurant and then you go to the hotel. You feel that the player is a bit of a bad guy at that moment. I'm not a good guy. I don't know how I feel. I can do this. They first face me, take me back after you. Oh, joy. Ohh! I'm happy with it. I feel like I AM going to eat one ball. Let's see if the others in kunnen de hers. I'm going to eat it in to the middle of their middle. I fucking bought a ball. Hyung! A hand 높ish race. We can do a horde Stanley No one plays theseAD I think... front-� Meanwhile he wins First of all, I'm going to do the ball. Third of all, I'm going to do the ball. 1, 1, 1, come on. I'm going to the good night and I'm going to the loss. And I'm going to the ball and I'm going to the hole. Yes, I'm going to do it. It was a big hit. Oh, I'm going to the good night. Boom! And I'm going to the 2nd round. The whole round is coming."
23," Since the first time seeing the meets, it made a ninth legró have to travel on top. We think that if we get out of the box, it would also be very deep out. So I think often when Dodi had one laugh good luck. Sometimes he would say big handed. But I can't say anymore! I'm going to go on a walk. I have one ball. I don't know what it is. But I'm going to take a look at the ball and I'm going to take a look at it. This is the best. I'm going to take a look at the ball. And I'm going to take a look at it. And I'm going to take a look at it. And I think this is a bit of a joke. And I'm going to take a look at it. And I'm going to take a look at the edge of the edge of the edge of the land. It feels like I'm going to take a look at the last penalty. I'm going to take a look at it. And that's not the right thing. Come on. Come on. Good job, Martin. Come on, Martin. What's going on? Oh, yes. I'm going to take a look at the new energy from the edge of the land. What's going on? This is the first one. What have you learned, what have you learned here? Three. Three. This corner is an athlete. You can't figure your останов version of the champions, that's great. You're going to believe something, that I think will definitely be the biggest. Well, we were suppose to get an egg going on. you're so tired watching that, I told you From nice"
24," You've done a great job here, we're yourmarkets. Stay grateful, let's give this a nice time. I'm forced to do that permanently here but I don't want to make a problem here, then it's such a big matter, but here it is. I'll send you to something new next step, will it be enough for you to do better grades there. We should go, eventually. Yes, I've become a tenthята for the exams and I'll come back tomorrow. to enjoy the way I am doing. The best thing for me is forgetentto. So strong. His date wasatu不知道. So Africans. They signed the often said Africa. So, it's also flying Dutchmen, that's where I'm going to the airport. We're not going to be alone. We've been together for a while. I've been together for a while. I've been together for two years. Oh, I'm a man. I'm a man. And the last ball that I chose was really the orange. I'm a ball, but I'm not going to be the best one to me. Yes. The wind is for Tim Groen. But now I'm going to the airport to the airport. Thank you. I'm happy to meet you. Tim Groen, I'm here to see you on the island. Tomorrow, I'll be back in the island. I'm going to the airport to the airport."
25," When we were a team had in November we'd done that and third in September. And that's what we thought, that I didn't want to pay you back. I'm going to talk to ourselves. I don't know if people was going out far shortly. They know things that were the best, but we earn as much at the juicers. They are fed off. ganzen things. This is not going to bother us. We're going to the next episode. We're going to the next episode. We're going to the next episode. We're going to the next episode. We're going to the next episode. So I think that's a good idea. And the TNF will go on the lead. The issue is not going to be a problem. The biggest problem is that the weather is going to be nice. And that's a lot of fun. We're going to the Aiden. And I think that's the E-Pill. And that's a nice, cool, nice. In the C-Pohoof, I don't really like that much. I don't really like that. I hope you'll like it. Well, we're going to the next episode."
26," Holding ways for a moment This is where it's possible to get the deposits of April. As if they could assure the sale. Neels must continue as a стрotege one between us a couple of months. A second and hence, a few minutes later. Let me go. Right towards the sea numbers. How does your carcass behave? habith... What do you do? You're working really well. I think I'm not that good. No. I'm going to take you to the hospital. How do you do that? I'm not going to take you to the hospital. You know that? I'm going to take you to the hospital. I'm going to take you to the hospital. I'm not so happy to be here. I'm still in the hospital. I can't do anything. I'm running away from everything. It's a dream. It's a dream. I'm going to go to the hospital soon. Of course I will go outside during the crossing while walking outside. I'mήσed in company manager. I'm in a vet in County auf flak. Everybody else jokes about us. We should be內folding your team. We decide what will happen if you wish where you go. That's true. Weisu to have fun. That's proud. Good to see you. We hope that tonight? Yes. Probably that's all dreams, I can always say something, I only say a rose. Hearing time organised. It has been a good story, right? Are you kidding me? Nyor jun jeno Not a share"
27," Delt & Idea تم What is it? That's a piece. That is... That is nice. And then what do you want? Okay. Timor, you know, Timparks is a native island. You have the chance to travel with one of them. Who are you? Here you can see two portraits of this one. If one of them is a native island, You can see the highest sign of the city. You can see it. Okay. Let's go. Here you go. We're going to see. Oh, that's a bit of a bit of a sign. Timparks is in the coast. Timparks. That's a lot of fish. Oh, here you go. Here you go. Oh. There are a lot of fish. Oh. And if one of them is a native island, a native island. It's a lot of fish. It's a bit of a geat. Oh. Hey. What the fuck? What the fuck? What the fuck? What the fuck? Oh. So the question is, do you want to be a real star in a bunch of people? I think it's a lot of fun. Yeah. You can be a star in your channel. You can also be a star in your country. Yeah. Well, as a well, you can now see the new view. The net for the sea is called the zoo. The zoo is called the zoo. The zoo is called the zoo. So that's what we've got to talk about. Well, one of the most important things is to come to the end of the year. And there's everyone with me. How do you feel? I'm feeling good. I'm feeling good. I'm feeling good. I'm feeling good. I'm feeling good. I'm feeling good. I'm feeling good."
28," It is often being classified as an anti-g mientras that human being is fear but nobody got any rights to hide this beast and Mike transports voices But when we change the polarized seats Rome was so miserable Freddy was crazy and it modelers candles on when I faço each plane A weather storeroom who喜欢 quick views from one main filmverbs are clear to us that he is not very happy Counterfeit chart, with April... so that no friendly to me. But, for a minute with an infinitetext... my daily life, is offering a Additional Peer shower. Team Ty媽. Good night, dead, from the very right. How did you get in this process? OK. It's a bit harmless in the team. I see. I can't see you. Why did you bring it? I've said it many times. I'm really happy in the real court of the period. So I'm very excited about the case. OK. Have you been there for a long time? It was a roller coaster. Why did you bring it? Yes, a big deal. And how did you find your own confrontation? How did you get there? Yes, I'm glad you got the confrontation. I don't know if you can see it. Russian kids and things. I think that's what I'm doing with all the footballers. That's the same thing in the boot. And this is not the moment you're going to get there. So you're going to be able to stay in the middle of the stage. Yes. It's a lot of fun. For the system, you can have a lot of fun. You can have a plunder. You can have a new set. Not fun. Then you can have a lot of fun. You can have a lot of fun. And you can have a lot of fun."
29," From the way and more, I am leaving for the interestingery prison. Eens, others are free from free. This is hownym Но Talk in Hispanic and muscle systems would survive. On 18th May, ten years ago. Two years later, the taxi will surely come with a few extra susceptible tests. Think thoroughly about the Orbles. F confidence so Ben330 will rule. Not to mention this. The song Synelle Ladeff doesn't school in the middle of the tuition jets. They play the entire song well. I'm not satisfied with it, but I agree with it. Everything seems like it's harder to finish it than to racing around an Africa lap. Then normal feeling Wett on."
30," This is the end of the day. The system is built. I'm going to check if the video is built. But first, I can't be alone from a unit to a unit. And it's now time to set up. I'll start. The first system. Priaf Eddie. The second system. Opeo. The third system. The second system. It's for different. Fear to stem. I'll try different. Two stem for Ferry. Two stem for different. I'll take the last system. The fifth system. It's for... different. Different that you have in your mind. Snow. In what bigoru standon for? Ferry. I expected. What we've got behind it. When I come home and walk around and be busy, you don't know me. Or club members are dreaming I never go to the park or dance. When you think you know how to do winter, there's no problems with Drenners. At Atrean we get a real puigy, he's just the set out to join theKUrender. I'm not sure if I can do that. I'm going to take the car first. That's what I'm going to do. Peter, you're a champion. Yes. I'm going to take my own special thing. Can I get over you? Here you are. You're a bit... I'm going to do this. I'm not going to do this. No. It's fine. Yes, I'm going to do this. I'm going to do this. No. Yes, I'm going to do it. What a great day. I'm going to do it."
31," You're in the morning, you're going to sleep from the morning. Good morning, Mr. Sikse. Or the day after? Yes, I'm in the morning. You're in the morning, you're in the morning. Wherever you are, just once. This is up to you. I'm going for yourbye. Do you have a doctor? No. I'm not at home. Hit you and let me test himroclaw gum. You're in a week. We can really practice the evening. And that we have a deeperle."
32," So that's pow hovers. So we could have followed the machine today. Yes, you know. The government had it in was called S. I think. M那 C.. I had one new typical. I were looking forward from this species Kieneux, for now. Dism feedback from yourself! I mess with it!"
